{
  "contract_version": "1.0",
  "n_events": 2,
  "n_points": 6,
  "event_thr_mm_h": 5.0,
  "notes": "Synthetic mock baseline results for pipeline validation and Replay UI preview.",
  "by_method": {
    "persistence": {
      "POD": 0.45,
      "FAR": 0.38,
      "CSI": 0.34,
      "brier": 0.22
    },
    "extrapolation": {
      "POD": 0.68,
      "FAR": 0.27,
      "CSI": 0.54,
      "brier": 0.16
    },
    "steps_ensemble": {
      "POD": 0.76,
      "FAR": 0.22,
      "CSI": 0.63,
      "brier": 0.13
    },
    "lightgbm": {
      "POD": 0.74,
      "FAR": 0.2,
      "CSI": 0.62,
      "brier": 0.12
    },
    "blend": {
      "POD": 0.81,
      "FAR": 0.18,
      "CSI": 0.69,
      "brier": 0.1
    }
  },
  "by_lead": {
    "30": {
      "blend": {
        "POD": 0.9,
        "FAR": 0.1,
        "CSI": 0.82,
        "brier": 0.06
      }
    },
    "60": {
      "blend": {
        "POD": 0.81,
        "FAR": 0.18,
        "CSI": 0.69,
        "brier": 0.1
      }
    },
    "90": {
      "blend": {
        "POD": 0.72,
        "FAR": 0.24,
        "CSI": 0.58,
        "brier": 0.14
      }
    },
    "120": {
      "blend": {
        "POD": 0.64,
        "FAR": 0.3,
        "CSI": 0.49,
        "brier": 0.18
      }
    },
    "150": {
      "blend": {
        "POD": 0.56,
        "FAR": 0.35,
        "CSI": 0.42,
        "brier": 0.21
      }
    },
    "180": {
      "blend": {
        "POD": 0.49,
        "FAR": 0.4,
        "CSI": 0.36,
        "brier": 0.25
      }
    }
  },
  "alerts": {
    "hit": 4,
    "miss": 0,
    "false_alarm": 1,
    "correct_null": 1,
    "median_lead_time_min": 45.0
  },
  "per_event": [
    {
      "id": "evt_mock_01",
      "hit": 3,
      "miss": 0,
      "false_alarm": 0,
      "median_lead_time_min": 45.0
    },
    {
      "id": "evt_mock_02",
      "hit": 0,
      "miss": 0,
      "false_alarm": 0,
      "median_lead_time_min": 0.0
    }
  ],
  "blend_weight_ens": 0.65
}